{
  "schema_version": 1,
  "profile_id": "xckm.v1",
  "title": "Maze (x c k m)",
  "help": "The pad steers with the game's own keys: x left, c right, k up, m down.",
  "orientation": "portrait",
  "actions": [
    {
      "id": "up",
      "label": "Up",
      "icon": "arrow_up",
      "output": {
        "text": "k"
      },
      "repeat": {
        "delay_ms": 300,
        "interval_ms": 110
      }
    },
    {
      "id": "down",
      "label": "Down",
      "icon": "arrow_down",
      "output": {
        "text": "m"
      },
      "repeat": {
        "delay_ms": 300,
        "interval_ms": 110
      }
    },
    {
      "id": "left",
      "label": "Left",
      "icon": "arrow_left",
      "output": {
        "text": "x"
      },
      "repeat": {
        "delay_ms": 300,
        "interval_ms": 110
      }
    },
    {
      "id": "right",
      "label": "Right",
      "icon": "arrow_right",
      "output": {
        "text": "c"
      },
      "repeat": {
        "delay_ms": 300,
        "interval_ms": 110
      }
    },
    {
      "id": "quit",
      "label": "Quit",
      "icon": "close",
      "output": {
        "text": "q"
      },
      "confirm": true
    }
  ],
  "layout": {
    "portrait": [
      {
        "type": "dpad4",
        "anchor": "bottom_start",
        "size": 184,
        "bind": {
          "up": "up",
          "down": "down",
          "left": "left",
          "right": "right"
        }
      },
      {
        "type": "button",
        "anchor": "bottom_end",
        "size": 64,
        "bind": {
          "press": "quit"
        }
      }
    ],
    "landscape": [
      {
        "type": "dpad4",
        "anchor": "center_start",
        "size": 176,
        "bind": {
          "up": "up",
          "down": "down",
          "left": "left",
          "right": "right"
        }
      },
      {
        "type": "button",
        "anchor": "top_end",
        "size": 52,
        "bind": {
          "press": "quit"
        }
      }
    ]
  },
  "gestures": {
    "swipe_up": "up",
    "swipe_down": "down",
    "swipe_left": "left",
    "swipe_right": "right"
  },
  "pointer": "none",
  "keyboard": true
}
